{
  "evidence_channels": [
    {
      "channel": "normalized_events",
      "encoded_bytes": null,
      "item_count": 0,
      "logical_bytes": 0,
      "requested": false,
      "status": "omitted"
    },
    {
      "channel": "capabilities",
      "encoded_bytes": null,
      "item_count": 0,
      "logical_bytes": 0,
      "requested": false,
      "status": "omitted"
    },
    {
      "channel": "native_evidence",
      "encoded_bytes": null,
      "item_count": 1,
      "logical_bytes": 405,
      "requested": true,
      "status": "complete"
    },
    {
      "channel": "frames",
      "encoded_bytes": null,
      "item_count": 0,
      "logical_bytes": 0,
      "requested": false,
      "status": "omitted"
    },
    {
      "channel": "snapshots",
      "encoded_bytes": null,
      "item_count": 0,
      "logical_bytes": 0,
      "requested": false,
      "status": "omitted"
    },
    {
      "channel": "input_value_evidence",
      "encoded_bytes": null,
      "item_count": 0,
      "logical_bytes": 0,
      "requested": false,
      "status": "omitted"
    },
    {
      "channel": "envelope",
      "encoded_bytes": null,
      "item_count": 2,
      "logical_bytes": 0,
      "requested": true,
      "status": "complete"
    }
  ],
  "evidence_receipt": {
    "budgets": {
      "configured": {
        "max_capability_bytes": null,
        "max_frame_bytes": null,
        "max_input_value_bytes": null,
        "max_input_value_events": null,
        "max_native_bytes": null,
        "max_native_events": null,
        "max_normalized_bytes": null,
        "max_normalized_events": null,
        "max_snapshot_bytes": null,
        "max_total_logical_bytes": null
      },
      "exceeded": null,
      "observed_logical_bytes": 405
    },
    "capabilities": [],
    "channels": [
      {
        "channel": "normalized_events",
        "encoded_bytes": null,
        "item_count": 0,
        "logical_bytes": 0,
        "requested": false,
        "status": "omitted"
      },
      {
        "channel": "capabilities",
        "encoded_bytes": null,
        "item_count": 0,
        "logical_bytes": 0,
        "requested": false,
        "status": "omitted"
      },
      {
        "channel": "native_evidence",
        "encoded_bytes": null,
        "item_count": 1,
        "logical_bytes": 405,
        "requested": true,
        "status": "complete"
      },
      {
        "channel": "frames",
        "encoded_bytes": null,
        "item_count": 0,
        "logical_bytes": 0,
        "requested": false,
        "status": "omitted"
      },
      {
        "channel": "snapshots",
        "encoded_bytes": null,
        "item_count": 0,
        "logical_bytes": 0,
        "requested": false,
        "status": "omitted"
      },
      {
        "channel": "input_value_evidence",
        "encoded_bytes": null,
        "item_count": 0,
        "logical_bytes": 0,
        "requested": false,
        "status": "omitted"
      },
      {
        "channel": "envelope",
        "encoded_bytes": null,
        "item_count": 2,
        "logical_bytes": 0,
        "requested": true,
        "status": "complete"
      }
    ],
    "failure": null,
    "fulfilled_guarantee": "summary",
    "machine_id": "tic80",
    "machine_version": "tic80-python-bundle",
    "requested_guarantee": "summary",
    "run_id": "python-tic80-1",
    "schema_version": {
      "major": 2,
      "minor": 1,
      "patch": 0
    },
    "status": "complete"
  },
  "execution_result": {
    "capabilities": [],
    "common": {
      "boot_success": true,
      "cycles": 8,
      "frames": 8,
      "termination": "frame_limit"
    }
  },
  "host": {
    "machine": "x86_64",
    "packages": {
      "glassvm": "0.1.1",
      "glassvm-tic80": "0.1.1"
    },
    "processor": "x86_64",
    "python": "3.12.13 (main, Jul 18 2026, 17:02:19) [Clang 22.1.3 ]",
    "python_implementation": "CPython",
    "release": "5.15.133.1-microsoft-standard-WSL2",
    "rustc": "rustc 1.97.1 (8bab26f4f 2026-07-14)",
    "system": "Linux",
    "uv_version": "uv 0.12.1 (x86_64-unknown-linux-gnu)"
  },
  "kind": "run",
  "memory": {
    "allocator_high_water_bytes": null,
    "allocator_note": "No allocator high-water API is exposed by the Python provider protocol.",
    "peak_rss_bytes": 28766208,
    "peak_rss_native_unit": "KiB",
    "peak_rss_native_value": 28092,
    "rss_before_native_value": 21684
  },
  "negotiation": {
    "optional_unavailable_capabilities": [],
    "prepared_observation_identity": {
      "algorithm": "sha256",
      "value": [
        126,
        154,
        116,
        165,
        158,
        57,
        45,
        206,
        136,
        117,
        185,
        123,
        58,
        158,
        118,
        228,
        234,
        14,
        137,
        53,
        240,
        31,
        34,
        46,
        113,
        40,
        169,
        211,
        209,
        242,
        168,
        123
      ]
    }
  },
  "outcomes": {
    "evidence_status": "complete",
    "machine_execution": {
      "boot_success": true,
      "cycles": 8,
      "frames": 8,
      "termination": "frame_limit"
    },
    "recorder_status": "complete"
  },
  "publication": {
    "published": true,
    "run_directory_bytes": 5131,
    "run_reference_retained": false
  },
  "recorder": {
    "block_count": null,
    "channel_stats_available": false,
    "channel_stats_note": "Installed recorder receipt predates per-channel bounded counters.",
    "channels": null,
    "encoded_bytes": 342,
    "file_count": 4,
    "finalized": true,
    "logical_bytes": 424,
    "record_count": null,
    "schema": {
      "id": "glassvm.recorder_receipt",
      "version": {
        "major": 1,
        "minor": 0,
        "patch": 0
      }
    },
    "segment_count": 1,
    "status": "complete"
  },
  "recorder_receipt": {
    "encoded_bytes": 342,
    "evidence_receipt_published": true,
    "evidence_status": "complete",
    "failure": null,
    "file_count": 4,
    "finalized": true,
    "logical_bytes": 424,
    "schema": {
      "id": "glassvm.recorder_receipt",
      "version": {
        "major": 1,
        "minor": 0,
        "patch": 0
      }
    },
    "segment_count": 1,
    "status": "complete"
  },
  "request": {
    "configuration": {
      "schema": {
        "id": "tic80.machine_configuration",
        "version": {
          "major": 1,
          "minor": 0,
          "patch": 0
        }
      },
      "value": {
        "Map": {
          "cycles_per_frame": {
            "Unsigned": 1
          },
          "machine_seed": {
            "Unsigned": 0
          },
          "runtime": {
            "Text": "lua"
          }
        }
      }
    },
    "execution_controls": {
      "bundle_limits": [],
      "frame_limit": 8,
      "step_limit": null
    },
    "input_schedule": {
      "entries": [],
      "schema": {
        "id": "glassvm.input_schedule",
        "version": {
          "major": 1,
          "minor": 0,
          "patch": 0
        }
      }
    },
    "observation": {
      "budgets": {},
      "capabilities": [],
      "frames": {
        "capture": "none"
      },
      "guarantee": "summary",
      "input_value_evidence": {
        "enabled": false
      },
      "native_evidence": {
        "all": false,
        "enabled": true,
        "kinds": [
          "tic80.execution_summary"
        ]
      },
      "normalized_events": {
        "access_detail": "none",
        "events": "none",
        "state_diffs": false
      },
      "overflow": "fail",
      "schema_version": {
        "major": 2,
        "minor": 1,
        "patch": 0
      },
      "snapshots": {
        "capture": "none"
      }
    }
  },
  "result_schema_version": "1.0.0",
  "source": {
    "installed_distribution_source_note": "Python provider metadata does not embed a source revision; distribution versions and provider metadata are recorded separately.",
    "installed_distribution_source_revision": null,
    "provider": {
      "bundle_version": "0.1.0",
      "distribution": "glassvm-tic80",
      "entry_point": "tic80",
      "execute_function": "execute_prepared",
      "machine_id": "tic80",
      "module": "glassvm_tic80",
      "prepare_function": "prepare_run",
      "protocol": "glassvm.python_bundle",
      "protocol_version": {
        "major": 1,
        "minor": 0,
        "patch": 0
      }
    },
    "workspace_references": {
      "glassvm_checkout": {
        "dirty": true,
        "revision": "d0c7a02d41134a6e559e276fd3ef81def96566bb"
      },
      "machines_checkout": {
        "dirty": false,
        "revision": "7cf884861e3cc22d6f15badc7265c969af032e0a"
      }
    }
  },
  "timing": {
    "discovery_seconds": 0.001372160999380867,
    "execute_and_publish_seconds": 0.020958266000889125,
    "preparation_seconds": 0.00021436800125229638,
    "process_lifecycle_seconds": 0.03724653000062972,
    "worker_process_seconds": 0.08170499399966502
  },
  "trial": {
    "machine_id": "tic80",
    "recipe_id": "selected_native",
    "repetition": 1,
    "started_utc": "2026-10-07T21:58:18.118821+00:00"
  },
  "workload": {
    "artifact_bytes": 11013,
    "artifact_path": "tic80/fixtures/paper/game.tic",
    "artifact_sha256": "f095a8ad534482a3aefbe0aa84c9b8bc47b74a89dd4202acbd5fc8b517995994",
    "configuration": {
      "cycles_per_frame": 1,
      "machine_seed": 0,
      "runtime": "lua"
    },
    "execution_controls": {
      "bundle_limits": [],
      "frame_limit": 8,
      "step_limit": null
    },
    "input_schedule": "empty"
  }
}
