{
  "evidence_channels": [
    {
      "channel": "normalized_events",
      "encoded_bytes": null,
      "item_count": 0,
      "logical_bytes": 0,
      "requested": false,
      "status": "omitted"
    },
    {
      "channel": "capabilities",
      "encoded_bytes": null,
      "item_count": 0,
      "logical_bytes": 0,
      "requested": false,
      "status": "omitted"
    },
    {
      "channel": "native_evidence",
      "encoded_bytes": null,
      "item_count": 0,
      "logical_bytes": 0,
      "requested": false,
      "status": "omitted"
    },
    {
      "channel": "frames",
      "encoded_bytes": null,
      "item_count": 0,
      "logical_bytes": 0,
      "requested": false,
      "status": "omitted"
    },
    {
      "channel": "snapshots",
      "encoded_bytes": null,
      "item_count": 0,
      "logical_bytes": 0,
      "requested": false,
      "status": "omitted"
    },
    {
      "channel": "input_value_evidence",
      "encoded_bytes": null,
      "item_count": 0,
      "logical_bytes": 0,
      "requested": false,
      "status": "omitted"
    },
    {
      "channel": "envelope",
      "encoded_bytes": null,
      "item_count": 2,
      "logical_bytes": 0,
      "requested": true,
      "status": "complete"
    }
  ],
  "evidence_receipt": {
    "budgets": {
      "configured": {
        "max_capability_bytes": null,
        "max_frame_bytes": null,
        "max_input_value_bytes": null,
        "max_input_value_events": null,
        "max_native_bytes": null,
        "max_native_events": null,
        "max_normalized_bytes": null,
        "max_normalized_events": null,
        "max_snapshot_bytes": null,
        "max_total_logical_bytes": null
      },
      "exceeded": null,
      "observed_logical_bytes": 0
    },
    "capabilities": [],
    "channels": [
      {
        "channel": "normalized_events",
        "encoded_bytes": null,
        "item_count": 0,
        "logical_bytes": 0,
        "requested": false,
        "status": "omitted"
      },
      {
        "channel": "capabilities",
        "encoded_bytes": null,
        "item_count": 0,
        "logical_bytes": 0,
        "requested": false,
        "status": "omitted"
      },
      {
        "channel": "native_evidence",
        "encoded_bytes": null,
        "item_count": 0,
        "logical_bytes": 0,
        "requested": false,
        "status": "omitted"
      },
      {
        "channel": "frames",
        "encoded_bytes": null,
        "item_count": 0,
        "logical_bytes": 0,
        "requested": false,
        "status": "omitted"
      },
      {
        "channel": "snapshots",
        "encoded_bytes": null,
        "item_count": 0,
        "logical_bytes": 0,
        "requested": false,
        "status": "omitted"
      },
      {
        "channel": "input_value_evidence",
        "encoded_bytes": null,
        "item_count": 0,
        "logical_bytes": 0,
        "requested": false,
        "status": "omitted"
      },
      {
        "channel": "envelope",
        "encoded_bytes": null,
        "item_count": 2,
        "logical_bytes": 0,
        "requested": true,
        "status": "complete"
      }
    ],
    "failure": null,
    "fulfilled_guarantee": "summary",
    "machine_id": "chip8",
    "machine_version": "chip8-python-bundle",
    "requested_guarantee": "summary",
    "run_id": "python-chip8-1",
    "schema_version": {
      "major": 2,
      "minor": 1,
      "patch": 0
    },
    "status": "complete"
  },
  "execution_result": {
    "capabilities": [],
    "common": {
      "boot_success": true,
      "cycles": 7200,
      "frames": 600,
      "termination": "Timeout"
    }
  },
  "host": {
    "machine": "x86_64",
    "packages": {
      "glassvm": "0.1.2",
      "glassvm-chip8": "0.1.2"
    },
    "processor": "x86_64",
    "python": "3.14.3 (main, Mar 10 2026, 18:18:50) [Clang 21.1.4 ]",
    "python_implementation": "CPython",
    "release": "5.15.133.1-microsoft-standard-WSL2",
    "rustc": "rustc 1.97.1 (8bab26f4f 2026-07-14)",
    "system": "Linux",
    "uv_version": "uv 0.12.1 (x86_64-unknown-linux-gnu)"
  },
  "kind": "run",
  "memory": {
    "allocator_high_water_bytes": null,
    "allocator_note": "No allocator high-water API is exposed by the Python provider protocol.",
    "peak_rss_bytes": 31412224,
    "peak_rss_native_unit": "KiB",
    "peak_rss_native_value": 30676,
    "rss_before_native_value": 22760
  },
  "negotiation": {
    "optional_unavailable_capabilities": [],
    "prepared_observation_identity": {
      "algorithm": "sha256",
      "value": [
        146,
        182,
        107,
        103,
        95,
        94,
        209,
        193,
        167,
        192,
        16,
        245,
        32,
        40,
        225,
        160,
        33,
        91,
        184,
        9,
        40,
        65,
        89,
        39,
        72,
        112,
        69,
        186,
        90,
        130,
        209,
        169
      ]
    }
  },
  "outcomes": {
    "evidence_status": "complete",
    "machine_execution": {
      "boot_success": true,
      "cycles": 7200,
      "frames": 600,
      "termination": "Timeout"
    },
    "recorder_status": "complete"
  },
  "publication": {
    "published": true,
    "run_directory_bytes": 4216,
    "run_reference_retained": false
  },
  "recorder": {
    "block_count": 0,
    "channel_stats_available": true,
    "channel_stats_note": null,
    "channels": [],
    "configured_limits": {
      "max_block_logical_bytes": 1048576,
      "max_buffered_bytes_per_channel": 1048576,
      "max_segment_logical_bytes": 2097152,
      "max_segment_records": 256
    },
    "configured_limits_source": "bundle Python provider recorder_limits() in the machine checkout revision recorded under source.workspace_references",
    "encoded_bytes": 0,
    "file_count": 3,
    "finalized": true,
    "logical_bytes": 0,
    "record_count": 0,
    "schema": {
      "id": "glassvm.recorder_receipt",
      "version": {
        "major": 1,
        "minor": 1,
        "patch": 0
      }
    },
    "segment_count": 0,
    "status": "complete"
  },
  "recorder_receipt": {
    "block_count": 0,
    "channels": [],
    "encoded_bytes": 0,
    "evidence_receipt_published": true,
    "evidence_status": "complete",
    "failure": null,
    "file_count": 3,
    "finalized": true,
    "logical_bytes": 0,
    "record_count": 0,
    "schema": {
      "id": "glassvm.recorder_receipt",
      "version": {
        "major": 1,
        "minor": 1,
        "patch": 0
      }
    },
    "segment_count": 0,
    "status": "complete"
  },
  "request": {
    "configuration": {
      "schema": {
        "id": "chip8.machine_configuration",
        "version": {
          "major": 2,
          "minor": 0,
          "patch": 0
        }
      },
      "value": {
        "Map": {
          "cycles_per_frame": {
            "Unsigned": 12
          },
          "machine_seed": {
            "Unsigned": 0
          },
          "quirks": {
            "Text": "chip8"
          }
        }
      }
    },
    "execution_controls": {
      "bundle_limits": [],
      "frame_limit": 600,
      "step_limit": null
    },
    "input_schedule": {
      "entries": [],
      "schema": {
        "id": "glassvm.input_schedule",
        "version": {
          "major": 1,
          "minor": 0,
          "patch": 0
        }
      }
    },
    "observation": {
      "budgets": {},
      "capabilities": [],
      "frames": {
        "capture": "none"
      },
      "guarantee": "summary",
      "input_value_evidence": {
        "enabled": false
      },
      "native_evidence": {
        "all": false,
        "enabled": false,
        "kinds": []
      },
      "normalized_events": {
        "access_detail": "none",
        "events": "none",
        "state_diffs": false
      },
      "overflow": "fail",
      "schema_version": {
        "major": 2,
        "minor": 1,
        "patch": 0
      },
      "snapshots": {
        "capture": "none"
      }
    }
  },
  "result_schema_version": "1.0.0",
  "source": {
    "installed_distribution_source_note": "Python provider metadata does not embed a source revision; distribution versions and provider metadata are recorded separately.",
    "installed_distribution_source_revision": null,
    "provider": {
      "bundle_version": "0.1.0",
      "distribution": "glassvm-chip8",
      "entry_point": "chip8",
      "execute_function": "execute_prepared",
      "machine_id": "chip8",
      "module": "glassvm_chip8",
      "prepare_function": "prepare_run",
      "protocol": "glassvm.python_bundle",
      "protocol_version": {
        "major": 1,
        "minor": 0,
        "patch": 0
      }
    },
    "workspace_references": {
      "glassvm_checkout": {
        "dirty": true,
        "revision": "28b02ec04fc525c1fdca886c01f9436167979d13"
      },
      "machines_checkout": {
        "dirty": false,
        "revision": "1aca8f625f141adb72b959e413a11fb9e371cf3e"
      }
    }
  },
  "timing": {
    "discovery_seconds": 0.0014055859992367914,
    "execute_and_publish_seconds": 0.042522698000539094,
    "preparation_seconds": 0.00041922499985957984,
    "process_lifecycle_seconds": 0.052240208999137394,
    "worker_process_seconds": 0.09434377599973232
  },
  "trial": {
    "machine_id": "chip8",
    "recipe_id": "disabled",
    "repetition": 2,
    "started_utc": "2026-10-07T22:37:26.965187+00:00"
  },
  "workload": {
    "artifact_bytes": 1240,
    "artifact_path": "chip8/fixtures/paper/octojam2title.ch8",
    "artifact_sha256": "010f9ab220f55cc59645a6d05157b33a7099bac01037816ef06b74c2f8339b8a",
    "configuration": {
      "cycles_per_frame": 12,
      "machine_seed": 0,
      "quirks": "chip8"
    },
    "execution_controls": {
      "bundle_limits": [],
      "frame_limit": 600,
      "step_limit": null
    },
    "input_schedule": "empty"
  }
}
