{
  "evidence_channels": [
    {
      "channel": "normalized_events",
      "encoded_bytes": null,
      "item_count": 8,
      "logical_bytes": 2688,
      "requested": true,
      "status": "complete"
    },
    {
      "channel": "capabilities",
      "encoded_bytes": null,
      "item_count": 0,
      "logical_bytes": 0,
      "requested": false,
      "status": "omitted"
    },
    {
      "channel": "native_evidence",
      "encoded_bytes": null,
      "item_count": 0,
      "logical_bytes": 0,
      "requested": false,
      "status": "omitted"
    },
    {
      "channel": "frames",
      "encoded_bytes": null,
      "item_count": 0,
      "logical_bytes": 0,
      "requested": false,
      "status": "omitted"
    },
    {
      "channel": "snapshots",
      "encoded_bytes": null,
      "item_count": 0,
      "logical_bytes": 0,
      "requested": false,
      "status": "omitted"
    },
    {
      "channel": "input_value_evidence",
      "encoded_bytes": null,
      "item_count": 0,
      "logical_bytes": 0,
      "requested": false,
      "status": "omitted"
    },
    {
      "channel": "envelope",
      "encoded_bytes": null,
      "item_count": 2,
      "logical_bytes": 0,
      "requested": true,
      "status": "complete"
    }
  ],
  "evidence_receipt": {
    "budgets": {
      "configured": {
        "max_capability_bytes": null,
        "max_frame_bytes": null,
        "max_input_value_bytes": null,
        "max_input_value_events": null,
        "max_native_bytes": null,
        "max_native_events": null,
        "max_normalized_bytes": null,
        "max_normalized_events": null,
        "max_snapshot_bytes": null,
        "max_total_logical_bytes": null
      },
      "exceeded": null,
      "observed_logical_bytes": 2688
    },
    "capabilities": [],
    "channels": [
      {
        "channel": "normalized_events",
        "encoded_bytes": null,
        "item_count": 8,
        "logical_bytes": 2688,
        "requested": true,
        "status": "complete"
      },
      {
        "channel": "capabilities",
        "encoded_bytes": null,
        "item_count": 0,
        "logical_bytes": 0,
        "requested": false,
        "status": "omitted"
      },
      {
        "channel": "native_evidence",
        "encoded_bytes": null,
        "item_count": 0,
        "logical_bytes": 0,
        "requested": false,
        "status": "omitted"
      },
      {
        "channel": "frames",
        "encoded_bytes": null,
        "item_count": 0,
        "logical_bytes": 0,
        "requested": false,
        "status": "omitted"
      },
      {
        "channel": "snapshots",
        "encoded_bytes": null,
        "item_count": 0,
        "logical_bytes": 0,
        "requested": false,
        "status": "omitted"
      },
      {
        "channel": "input_value_evidence",
        "encoded_bytes": null,
        "item_count": 0,
        "logical_bytes": 0,
        "requested": false,
        "status": "omitted"
      },
      {
        "channel": "envelope",
        "encoded_bytes": null,
        "item_count": 2,
        "logical_bytes": 0,
        "requested": true,
        "status": "complete"
      }
    ],
    "failure": null,
    "fulfilled_guarantee": "summary",
    "machine_id": "pico8",
    "machine_version": "pico8-python-bundle",
    "requested_guarantee": "summary",
    "run_id": "python-pico8-1",
    "schema_version": {
      "major": 2,
      "minor": 1,
      "patch": 0
    },
    "status": "complete"
  },
  "execution_result": {
    "capabilities": [],
    "common": {
      "boot_success": true,
      "cycles": 8,
      "frames": 8,
      "termination": "frame_limit"
    }
  },
  "host": {
    "machine": "x86_64",
    "packages": {
      "glassvm": "0.1.1",
      "glassvm-pico8": "0.1.1"
    },
    "processor": "x86_64",
    "python": "3.12.13 (main, Jul 18 2026, 17:02:19) [Clang 22.1.3 ]",
    "python_implementation": "CPython",
    "release": "5.15.133.1-microsoft-standard-WSL2",
    "rustc": "rustc 1.97.1 (8bab26f4f 2026-07-14)",
    "system": "Linux",
    "uv_version": "uv 0.12.1 (x86_64-unknown-linux-gnu)"
  },
  "kind": "run",
  "memory": {
    "allocator_high_water_bytes": null,
    "allocator_note": "No allocator high-water API is exposed by the Python provider protocol.",
    "peak_rss_bytes": 28004352,
    "peak_rss_native_unit": "KiB",
    "peak_rss_native_value": 27348,
    "rss_before_native_value": 21572
  },
  "negotiation": {
    "optional_unavailable_capabilities": [],
    "prepared_observation_identity": {
      "algorithm": "sha256",
      "value": [
        203,
        108,
        54,
        28,
        19,
        132,
        211,
        73,
        215,
        197,
        200,
        224,
        12,
        215,
        247,
        142,
        74,
        39,
        90,
        123,
        150,
        214,
        108,
        115,
        187,
        94,
        168,
        77,
        117,
        145,
        179,
        242
      ]
    }
  },
  "outcomes": {
    "evidence_status": "complete",
    "machine_execution": {
      "boot_success": true,
      "cycles": 8,
      "frames": 8,
      "termination": "frame_limit"
    },
    "recorder_status": "complete"
  },
  "publication": {
    "published": true,
    "run_directory_bytes": 7010,
    "run_reference_retained": false
  },
  "recorder": {
    "block_count": null,
    "channel_stats_available": false,
    "channel_stats_note": "Installed recorder receipt predates per-channel bounded counters.",
    "channels": null,
    "encoded_bytes": 2192,
    "file_count": 4,
    "finalized": true,
    "logical_bytes": 2848,
    "record_count": null,
    "schema": {
      "id": "glassvm.recorder_receipt",
      "version": {
        "major": 1,
        "minor": 0,
        "patch": 0
      }
    },
    "segment_count": 1,
    "status": "complete"
  },
  "recorder_receipt": {
    "encoded_bytes": 2192,
    "evidence_receipt_published": true,
    "evidence_status": "complete",
    "failure": null,
    "file_count": 4,
    "finalized": true,
    "logical_bytes": 2848,
    "schema": {
      "id": "glassvm.recorder_receipt",
      "version": {
        "major": 1,
        "minor": 0,
        "patch": 0
      }
    },
    "segment_count": 1,
    "status": "complete"
  },
  "request": {
    "configuration": {
      "schema": {
        "id": "pico8.machine_configuration",
        "version": {
          "major": 1,
          "minor": 0,
          "patch": 0
        }
      },
      "value": {
        "Map": {
          "cycles_per_frame": {
            "Unsigned": 1
          },
          "instruction_budget": {
            "Unsigned": 500000
          },
          "machine_seed": {
            "Unsigned": 0
          }
        }
      }
    },
    "execution_controls": {
      "bundle_limits": [],
      "frame_limit": 8,
      "step_limit": null
    },
    "input_schedule": {
      "entries": [],
      "schema": {
        "id": "glassvm.input_schedule",
        "version": {
          "major": 1,
          "minor": 0,
          "patch": 0
        }
      }
    },
    "observation": {
      "budgets": {},
      "capabilities": [],
      "frames": {
        "capture": "none"
      },
      "guarantee": "summary",
      "input_value_evidence": {
        "enabled": false
      },
      "native_evidence": {
        "all": false,
        "enabled": false,
        "kinds": []
      },
      "normalized_events": {
        "access_detail": "none",
        "events": {
          "kinds": [
            "frame_completed"
          ]
        },
        "state_diffs": false
      },
      "overflow": "fail",
      "schema_version": {
        "major": 2,
        "minor": 1,
        "patch": 0
      },
      "snapshots": {
        "capture": "none"
      }
    }
  },
  "result_schema_version": "1.0.0",
  "source": {
    "installed_distribution_source_note": "Python provider metadata does not embed a source revision; distribution versions and provider metadata are recorded separately.",
    "installed_distribution_source_revision": null,
    "provider": {
      "bundle_version": "0.1.0",
      "distribution": "glassvm-pico8",
      "entry_point": "pico8",
      "execute_function": "execute_prepared",
      "machine_id": "pico8",
      "module": "glassvm_pico8",
      "prepare_function": "prepare_run",
      "protocol": "glassvm.python_bundle",
      "protocol_version": {
        "major": 1,
        "minor": 0,
        "patch": 0
      }
    },
    "workspace_references": {
      "glassvm_checkout": {
        "dirty": true,
        "revision": "d0c7a02d41134a6e559e276fd3ef81def96566bb"
      },
      "machines_checkout": {
        "dirty": false,
        "revision": "7cf884861e3cc22d6f15badc7265c969af032e0a"
      }
    }
  },
  "timing": {
    "discovery_seconds": 0.0015603809988533612,
    "execute_and_publish_seconds": 0.021919487000559457,
    "preparation_seconds": 0.000278290999631281,
    "process_lifecycle_seconds": 0.03979390300082741,
    "worker_process_seconds": 0.08574414400027308
  },
  "trial": {
    "machine_id": "pico8",
    "recipe_id": "selected_normalized",
    "repetition": 1,
    "started_utc": "2026-10-07T21:58:17.178140+00:00"
  },
  "workload": {
    "artifact_bytes": 18393,
    "artifact_path": "pico8/fixtures/paper/fireintro.p8",
    "artifact_sha256": "491888897d07e5699a5e411c9cb881181f313e6cad7b0dcfec2fd333ea0b833a",
    "configuration": {
      "cycles_per_frame": 1,
      "instruction_budget": 500000,
      "machine_seed": 0
    },
    "execution_controls": {
      "bundle_limits": [],
      "frame_limit": 8,
      "step_limit": null
    },
    "input_schedule": "empty"
  }
}
